name,address,rating,reviews_count,types,phone,website,reviews_sample,search_query,owner_name,emails,instagram,whatsapp,telegram,last_scenario,last_channel,pitch_cold_call,pitch_corporate_benefit_email,pitch_corporate_benefit_cold_call,pitch_partner_network_email,pitch_microbusiness_whatsapp,pitch_finvy_main_cold_call,pitch_microbusiness_cold_call,pitch_email,scenario,pitch_partner_network_cold_call,pitch_whatsapp,pitch_corporate_benefit_whatsapp,pitch_microbusiness_email,pitch_partner_network_whatsapp
Zebra Coffee,"улица Казахстан 64, 070000, Усть-Каменогорск 070000, Казахстан",4.7,7,"cafe, establishment, food, point_of_interest, store",,,"Кофе не понравился. Пережённый что ли, горчит. И молоко, оно невкусное, весь вкус кофе перебивает. Бонус дали шоколадку, Казахстан маленькую. | Самый лучший кофе в городе, очень позитивный кассир Валерия всегда поднимет настроение и что то подскажет, самый лучший кофе у молодого человека",,,,,,,Основной оффер Finvy,Звонок,"Скрипт для Zebra Coffee:
1. Зацепка: 'Видел ваш высокий рейтинг 4.7, отличная работа!'
2. Боль: 'Многие владельцы тратят часы на учет личных и бизнес-денег.'
3. Решение: 'Finvy делает это за 5 минут в день.'
4. Закрытие: 'Давайте встретимся на 10 минут во вторник?'",,,,,"Здравствуйте, это [Ваше имя] из компании Finvy. Я только что посмотрел ваш профиль – Zebra Coffee, 4,7 балла от семи отзывов. Один клиент даже отметил, что «кофе горчит», а другой – «самый лучший кофе в городе» и «позитивный кассир Валерия». Похоже, вы уже хорошо известны в Усть‑Каменогорске, но как вы сейчас контролируете затраты и прибыль?  

Представьте, что вы можете за три минуты увидеть, сколько реально остается после закупок, зарплаты, аренды и налогов. Finvy автоматически собирает все счета из Kaspi, Halyk и наличных, подсчитывает чистую прибыль, напоминает о налоговых дедлайнах и даже показывает, какая карта вернёт вам кэшбек при покупке продуктов. Это как бухгалтерия, но в одном приложении, и за цену подписки на Яндекс‑Музыку.  

У вас в среднем за месяц около 5 млн₸ дохода? Если из них вы тратите 2,1 млн₸ на закупки, 700 тыс. на зарплату, 250 тыс. на аренду, 370 тыс. на налоги, 160 тыс. на ГСМ и 100 тыс. на рекламу – то чистый остаток уже можно оптимизировать. Finvy покажет, где можно сэкономить, и предложит карту, которая вернёт кэшбек в размере 15 тыс.₸ в месяц.  

Первый месяц – бесплатно, отмена в один клик. Вы не теряете времени на Excel и не платите за бухгалтера 80 тыс.₸ в месяц. Как вам провести короткий демо‑звонок, чтобы увидеть, как это работает для вашего кафе?",,"**Тема:** Zebra Coffee + Finvy: бесплатный поток новых клиентов  

Уважаемая команда Zebra Coffee,

В Finvy у нас более 200 000 активных пользователей, которые ежедневно ищут лучшие места для кофе и ценят качество и атмосферу. Ваше заведение уже собралось в «Рекомендации» благодаря 4,7‑звёздному рейтингу и отзывам: «Самый лучший кофе в городе», «позитивный кассир Валерия» – это то, что привлекает наших клиентов.

Мы предлагаем разместить Zebra Coffee в разделе «Кеш‑бэк» и «Рекомендации» без каких‑либо затрат с вашей стороны. Это бесплатный маркетинговый канал, который приведёт к увеличению потока целевых посетителей и повышению продаж.

Готовы обсудить детали? Напишите нам на partnership@finvy.kz, и мы подберём оптимальный формат сотрудничества.  

С уважением,  
[Ваше имя]  
Менеджер по партнёрствам, Finvy",Партнёрская сеть — кешбэк и акции,,Здравствуйте! Предлагаем Zebra Coffee корпоративный доступ к Finvy для сотрудников. Это снижает их финансовый стресс и повышает лояльность к компании. Хотите короткое демо? 🚀,,,"Привет, команда Zebra Coffee! ☕️ У нас есть способ добавить в ваш уютный кофе 15% кешбэка от Finvy – ваш рейтинг 4.7 и отзывы «самый лучший кофе» делают вас магнитом для ценителей выгоды. Мы поможем разместить ваше кафе в разделе «Кешбэк», привлекая новых клиентов и давая аналитики по трафику. Готовы увеличить поток гостей? Да."
Coffee'78,"пр. Ауэзова 39, Усть-Каменогорск 070000, Казахстан",0,0,"cafe, establishment, food, point_of_interest, store",8 (705) 878 8218,https://www.instagram.com/_coffee78_/,,,,,rsrc.php,,,Основной оффер Finvy,Звонок,"Скрипт для Coffee'78:
1. Зацепка: 'Видел ваш высокий рейтинг 0, отличная работа!'
2. Боль: 'Многие владельцы тратят часы на учет личных и бизнес-денег.'
3. Решение: 'Finvy делает это за 5 минут в день.'
4. Закрытие: 'Давайте встретимся на 10 минут во вторник?'",,,,,"Здравствуйте, меня зовут Игорь из Finvy. Я только что посмотрел ваш профиль Coffee'78 в Instagram – отличный интерьер, вкусные напитки, но пока без отзывов. В Усть‑Каменогорске большинство кафе в среднем зарабатывают около 4–5 млн тенге в месяц, но 30–40 % от этой суммы часто уходит на непредвиденные расходы: налоги, зарплаты, кэшбэк‑карты, аренда и т. д.  

Я знаю, что вы, как и многие владельцы кофе‑баров, можете вести учёт в Excel или просто смотреть баланс в Kaspi, но это не всегда позволяет увидеть реальную картину. С Finvy вы:

 Получаете мгновенную отчётность – точный баланс, где видно, сколько денег ушло на закуп, зарплату, аренду и сколько осталось как чистая прибыль;
 Получаете напоминания о налоговых сроках, чтобы не платить штрафы;
 Видите, какая карта возвращает вам кэшбэк с каждой покупки, и автоматически меняете её, чтобы за каждый рубль вернуть максимум;
 Экономите часы работы бухгалтера – автоматический расчёт ОПВ, ОСМС и т.п.

В течение 7 дней вы можете попробовать сервис бесплатно и увидеть, как быстро вы сможете сэкономить время и найти скрытую прибыль. Как вам обсудить, сколько именно можно сэкономить в вашем кафе?",,"Тема: Развитие Coffee'78 через финтех-инструменты

Здравствуйте!

Мы проанализировали работу Coffee'78 и видим большой потенциал для оптимизации через Finvy. Наше решение позволяет эффективно управлять финансовыми потоками и привлекать новую аудиторию через систему кешбэка.

Готовы обсудить подробности?

С уважением, команда Finvy.",Партнёрская сеть — кешбэк и акции,,Здравствуйте! Предлагаем Coffee'78 корпоративный доступ к Finvy для сотрудников. Это снижает их финансовый стресс и повышает лояльность к компании. Хотите короткое демо? 🚀,,,"Привет, команда Coffee'78! 🚀  
Мы видим ваш уютный кафе на пр. Ауэзова и хотим предложить мгновенный приток новых клиентов. С Finvy и 15 % кешбэком вы сразу станете магнитом для любителей кофе, а наши аналитики покажут, кто именно заходит в ваш бар.  
Готовы разместиться в разделе «Кешбэк» и начать привлекать новых посетителей?"
Кофеин,"наб. имени Славского 22, Усть-Каменогорск 070004, Казахстан",4.3,51,"cafe, establishment, food, point_of_interest, store",,,"Обслуживание отличное. За то, что пришлось подождать немного, дали в подарок шоколад. Мелочь, а приятно. Такой подход к клиентам конечно скажется положительно | #Кофеин- место, где исполняют любые твои желания....Приходите...Не пожалеете!

На самом деле,я не особый ценитель кофе,а тем более не гурман. Да и удивить меня сложно.Но сегодня, побывав в этом месте, меня приятно порадовало обслуживание, огромный выбор горячих и холодных напитков,и особенно мои любимые суши @imperia_sushi_uk . Спасибо Вам за  вкусный #кофесхалвой. Я никогда не пробовала столь приятный напиток с огромной палитрой вкусов.",,,,,,,Основной оффер Finvy,Звонок,"Скрипт для Кофеин:
1. Зацепка: 'Видел ваш высокий рейтинг 4.3, отличная работа!'
2. Боль: 'Многие владельцы тратят часы на учет личных и бизнес-денег.'
3. Решение: 'Finvy делает это за 5 минут в день.'
4. Закрытие: 'Давайте встретимся на 10 минут во вторник?'",,,,,"Привет, я [Ваше имя] из Finvy. Позвольте сразу перейти к делу – я заметил, что ваш «Кофеин» в Усть‑Каменогорске уже собрал 51 отзыв и держит рейтинг 4,3. Это отличный показатель, но как часто вы видите, сколько реально зарабатывает ваш бар?  

В кафе с таким потоком клиентов, как у вас, в среднем на 30 % от выручки уходит на закуп сырья, 15 % – на зарплаты, 10 % – на аренду и коммунальные платежи. Если вы не контролируете каждый рубль, часть прибыли просто «потеряется» в бумагах и непроверенных счетах.  

Finvy умеет показать вам реальный доход в реальном времени, напомнить о налогах до того, как появятся штрафы, подсчитать, сколько вы действительно платите каждому сотруднику, и даже посоветовать карту, которая вернёт вам максимум кэшбека за закупки. Всё это в одном приложении, а первый месяц – бесплатно.  

Не тратьте часы на Excel и бухгалтерию. Позвоните мне, и я покажу, как быстро подключить Finvy и увидеть скрытую прибыль вашего кафе.",,"Тема: Развитие Кофеин через финтех-инструменты

Здравствуйте!

Мы проанализировали работу Кофеин и видим большой потенциал для оптимизации через Finvy. Наше решение позволяет эффективно управлять финансовыми потоками и привлекать новую аудиторию через систему кешбэка.

Готовы обсудить подробности?

С уважением, команда Finvy.",Партнёрская сеть — кешбэк и акции,,Здравствуйте! Предлагаем Кофеин корпоративный доступ к Finvy для сотрудников. Это снижает их финансовый стресс и повышает лояльность к компании. Хотите короткое демо? 🚀,,,"Привет, команда Кофеин! ☕️ Я увидел ваш уютный кофе‑бар на Славского 22 с 4.3 звёзд и замечательными отзывами. С Finvy вы можете предложить клиентам 15 % кешбэк на все ваши напитки через раздел «Кешбэк» – это магнит для тех, кто ценит выгоду и качественный сервис. Это не просто реклама, а полноценная интеграция в их лайфстайл. Готовы обсудить детали?"
Kulikov,"070000, Усть-Каменогорск 070000, Казахстан",5,2,"cafe, establishment, food, point_of_interest, store",8 (708) 638 7660,http://kulikov.kz/,"Отличное заведение покупали медовик в банке и два рожка с мороженым из смородины. Смородина реально чувствуется, а медовик так себе. Сотрудники супер, все обошлось в 5$. Советую Kulikov 👍 | Очень рада ,что смогла порадовать себя вкусняшками и собой взять в Астану.",,,,kulikov_kg,,,Основной оффер Finvy,Звонок,"Скрипт для Kulikov:
1. Зацепка: 'Видел ваш высокий рейтинг 5, отличная работа!'
2. Боль: 'Многие владельцы тратят часы на учет личных и бизнес-денег.'
3. Решение: 'Finvy делает это за 5 минут в день.'
4. Закрытие: 'Давайте встретимся на 10 минут во вторник?'",,,,,"Здравствуйте, меня зовут [Ваше имя] из команды Finvy. Я заметил, что ваш кафе «Kulikov» в Усть‑Каменогорске имеет отличный рейтинг 5 из 2 отзывов и популярные десерты – медовик и мороженое с смородиной. По отзывам клиенты отмечают, что всё обошлось в 5 долларов, а сотрудники – супер.

У меня есть несколько вопросов: сколько в среднем за день вы продаёте десерты? Если в среднем 30 заказов по 5 долларов, это почти 150 долларов в день, но вы, возможно, не видите, сколько из этой суммы действительно остаётся в вашем кошельке, а сколько тратится на закупки, аренду, налоги и т.д. Finvy позволяет быстро собрать все ваши счета – от кассы и банковских карт до наличных – и показать реальную прибыль за месяц в режиме реального времени, без Excel и бухгалтеров. Вы сможете увидеть, сколько кэшбека вы теряете, и какие карты приносят максимум возврата.

Предлагаю вам подключиться к Finvy на 7‑дневный бесплатный период. За три минуты вы сможете увидеть, где скрываются траты, где можно сэкономить и как не упустить налоговые дедлайны. Это как иметь личного финансового аналитика, который работает 24 часа, но стоит меньше, чем подписка на Яндекс Музыку. Как вам такой план?",,"Тема: Развитие Kulikov через финтех-инструменты

Здравствуйте!

Мы проанализировали работу Kulikov и видим большой потенциал для оптимизации через Finvy. Наше решение позволяет эффективно управлять финансовыми потоками и привлекать новую аудиторию через систему кешбэка.

Готовы обсудить подробности?

С уважением, команда Finvy.",Партнёрская сеть — кешбэк и акции,,Здравствуйте! Предлагаем Kulikov корпоративный доступ к Finvy для сотрудников. Это снижает их финансовый стресс и повышает лояльность к компании. Хотите короткое демо? 🚀,,,"Привет, команда Kulikov! У нас есть предложение, которое поднимет ваш кофе и десерты на новый уровень: 15 % кешбэк на всё через Finvy. Пользователи уже ценят выгоду, а отзывы о медовике и смородиновом мороженом в вашем кафе – отличный повод для новых клиентов. Давайте разместим ваш бренд в разделе «Рекомендации» и «Кешбэк», и вы увидите рост трафика и продаж. Заинтересованы?"
Fjord Coffee,"пр-т. Нурсултана Назарбаева 52, Усть-Каменогорск 070001, Казахстан",5,6,"cafe, establishment, food, point_of_interest, store",8 (700) 470 6409,,Одна из самых уютных кофеен  в городе. Камила очень очаровательная и вежливая бариста. Обслуживание и напитки на высшем уровне 👍✨ | Добродушное место ! Особенности подчеркнул бы девушку за милую улыбку,,,,,,,Основной оффер Finvy,Звонок,"Скрипт для Fjord Coffee:
1. Зацепка: 'Видел ваш высокий рейтинг 5, отличная работа!'
2. Боль: 'Многие владельцы тратят часы на учет личных и бизнес-денег.'
3. Решение: 'Finvy делает это за 5 минут в день.'
4. Закрытие: 'Давайте встретимся на 10 минут во вторник?'",,,,,"Добрый день, меня зовут [Ваше имя], я представляю Finvy. Я заметил, что Fjord Coffee – одна из самых уютных кофеен Усть‑Каменогорска с пятёркой и отзывами о дружелюбной баристой. Как вы сейчас ведёте учёт расходов и доходов?  

В большинстве кафе, где вырабатывается 5‑звёздный рейтинг, расходы на закупку и аренду могут составлять почти 60 % от выручки, но при этом анализировать это занимает часы. С Finvy вы получите точный расчёт чистой прибыли за минуты, напомню о налоговых дедлайнах и покажу, какая карта даст максимальный кэшбек.  

В течение первых семи дней подписка бесплатна, отмена – в один клик, а подключение занимает всего три минуты. Хотели бы вы узнать, как можно сэкономить ваш рабочий день и найти скрытую прибыль?",,"Тема: Развитие Fjord Coffee через финтех-инструменты

Здравствуйте!

Мы проанализировали работу Fjord Coffee и видим большой потенциал для оптимизации через Finvy. Наше решение позволяет эффективно управлять финансовыми потоками и привлекать новую аудиторию через систему кешбэка.

Готовы обсудить подробности?

С уважением, команда Finvy.",Партнёрская сеть — кешбэк и акции,,Здравствуйте! Предлагаем Fjord Coffee корпоративный доступ к Finvy для сотрудников. Это снижает их финансовый стресс и повышает лояльность к компании. Хотите короткое демо? 🚀,,,"Привет! 👋 Я из Finvy – в нашем приложении 15 % кешбэк на всё. Fjord Coffee уже завоевала 5‑звездный рейтинг и любима как «одна из самых уютных кофеен» в Усть‑Каменогрске. Мы хотим разместить ваш бренд в разделе «Рекомендации» и «Кешбэк», чтобы новые ценители выгоды быстро нашли ваш уют. Готовы стать партнёром?"
