name,address,rating,reviews_count,types,phone,website,reviews_sample,search_query,owner_name,emails,instagram,whatsapp,telegram,last_scenario,last_channel,pitch_cold_call,pitch_corporate_benefit_email,pitch_corporate_benefit_cold_call,pitch_partner_network_email,pitch_microbusiness_whatsapp,pitch_finvy_main_cold_call,pitch_microbusiness_cold_call,pitch_email,scenario,pitch_partner_network_cold_call,pitch_whatsapp,pitch_corporate_benefit_whatsapp,pitch_microbusiness_email,pitch_partner_network_whatsapp
Оралхан Бөкей атындағы кітапхана / Центральная городская библиотека имени Оралхана Бокея,"ул. Набережная имени Е, Славского,22, Усть-Каменогорск 070004, Казахстан",4.9,12,"establishment, library, point_of_interest",8 (705) 415 7368,http://bokeylibrary.kz/,"У библиотеки отличное расположение, однако хотелось бы, чтобы библиотека с такими ресурсами была более посещаемой, удобной и эргономичной. Некоторые моменты, требующие улучшения:
1. Отсутствие туалетной бумаги и сушилок в туалетных комнатах
2. Слабое освещение в читальных залах и/или отсутствие дополнительных ламп на столах. Уверена, в зимнее время - это необходимость, так как читать при действующем освещении - проблема.
3. Отсутствие специально отведенной ""тихой зоны"", в которой можно было погрузиться в чтение
4. Отсутствие островка, где продавали бы кофе, чай, воду и перекусы
5. Слишком много нерабочего пространства (закрытых комнат, столов с книгами, которые закрывают уникальность библиотеки - вид на Иртыш).

Повторюсь, у библиотеки отличные ресурсы и она могла бы их монетизировать за счет сдачи в аренду острова для напитков (ну или хотя бы автомат или вода из фильтра), а также привлечение к сотрудничеству блогеров, инфлюенсеров и активистов города, которые могли бы проводить там встречи, talks, книгообмены, обсуждения книг и пр. Во всех развитых странах библиотека - это место концентрации умных, перспективных и прогрессивных людей, и в нашем городе - О.Бокея могла бы стать одним из таких мест.

Надеюсь, руководство Библиотеки примет во внимание эти предложения. При этом важно отметить, что в библиотеке уже имеется все необходимое для работы - столы, компьютеры, интернет, богатый книжный запас, но ведь  всегда есть к чему стремиться и что улучшать.

С уважением,
Мадина Дуанова | Вчера прошла экскурсию в центральной библиотеки им.О.Бокея была очень впечатлена  работой и использованием новых технологий в работе учреждения! Огромное спасибо, всех причастных к этой удивительной библиотеки!",,,,,,,Основной оффер Finvy,Звонок,"Скрипт для Оралхан Бөкей атындағы кітапхана / Центральная городская библиотека имени Оралхана Бокея:
1. Зацепка: 'Видел ваш высокий рейтинг 4.9, отличная работа!'
2. Боль: 'Многие владельцы тратят часы на учет личных и бизнес-денег.'
3. Решение: 'Finvy делает это за 5 минут в день.'
4. Закрытие: 'Давайте встретимся на 10 минут во вторник?'",,,,,"Здравствуйте, меня зовут [Ваше имя], я менеджер по продажам в Finvy.  
Я видел, что библиотека «Оралхан Бөкей атындағы» в Усть‑Каменогорске получила 4.9 балла из 12 отзывов – это значит, что посетители ценят ваш сервис, но в комментариях отмечают, что пространство можно сделать более удобным: освещение, «тихая» зона, зона с кофе, а также возможность монетизировать свободные помещения.

Эти улучшения требуют точного понимания, куда уходят деньги и где можно сэкономить. С Finvy вы сможете:

 В течение 3 минут увидеть реальную прибыль за месяц – не «приблизительно», а точные цифры.  
 Получать напоминания о налоговых сроках до того, как появятся штрафы.  
 Быстро рассчитывать, сколько реально платит библиотеке каждый сотрудник, включая все отчисления.  
 Выявлять, какая банковская карта при ваших расходах даст максимальный кэшбек – например, при покупке книг и материалов вы сможете вернуть до 15 000 тенге в месяц.  

У нас уже помогли подобные учреждения: они экономили до 3 000 часов работы бухгалтера в год и находили скрытую прибыль в 250 000 тенге, которую можно инвестировать в освещение, создание кофе‑кафе или аренду островка для мероприятий с блогерами и активистами.  

Могу ли я показать вам, как это работает в течение 7‑дневного бесплатного периода? Это займет всего 3 минуты и полностью отменит необходимость в Excel‑таблицах и ручном учёте. Если вам удобно, я могу подключить Finvy прямо сейчас.",,"Тема: Развитие Оралхан Бөкей атындағы кітапхана / Центральная городская библиотека имени Оралхана Бокея через финтех-инструменты

Здравствуйте!

Мы проанализировали работу Оралхан Бөкей атындағы кітапхана / Центральная городская библиотека имени Оралхана Бокея и видим большой потенциал для оптимизации через Finvy. Наше решение позволяет эффективно управлять финансовыми потоками и привлекать новую аудиторию через систему кешбэка.

Готовы обсудить подробности?

С уважением, команда Finvy.",Партнёрская сеть — кешбэк и акции,,Здравствуйте! Предлагаем Оралхан Бөкей атындағы кітапхана / Центральная городская библиотека имени Оралхана Бокея корпоративный доступ к Finvy для сотрудников. Это снижает их финансовый стресс и повышает лояльность к компании. Хотите короткое демо? 🚀,,,"Привет, команда Оралхан Бөкей атындағы кітапхана! 👋 У вас уже 4.9★ и богатый книжный запас, но 15% кешбэк от Finvy может привлечь к вашим читальным залам новых, экономичных посетителей. Мы предлагаем размещение в разделе «Рекомендации» и «Кешбэк», где ваши книги, мероприятия и даже кофе‑островок будут видны тем, кто ценит выгоду. Это не просто реклама – это интеграция в лайфстайл‑приложение, которое уже привлекает платежеспособных пользователей. Интересно обсудить детали?"
Ультрамарин,"ул. Крылова 66, Усть-Каменогорск 070000, Казахстан",0,0,"beauty_salon, establishment, point_of_interest",8 (777) 997 1716,,,,,,,,,Основной оффер Finvy,Звонок,"Скрипт для Ультрамарин:
1. Зацепка: 'Видел ваш высокий рейтинг 0, отличная работа!'
2. Боль: 'Многие владельцы тратят часы на учет личных и бизнес-денег.'
3. Решение: 'Finvy делает это за 5 минут в день.'
4. Закрытие: 'Давайте встретимся на 10 минут во вторник?'",,,,,"Здравствуйте, меня зовут [Ваше имя] из команды Finvy. Я звоню владельцам Ультрамарина, потому что наш сервис может сразу показать, сколько вы реально зарабатываете в каждом месяце, а не просто сколько пришло в кассу.  

У вас, как у beauty‑салона в Усть‑Каменогорске, обычно все расходы – закупка косметики, арендная плата, зарплата персонала, коммунальные услуги и налоги. Часто в итоге виден лишь общий баланс, а реальные цифры скрыты в бумагах и Excel‑таблицах.  

Finvy автоматизирует это всё:  

 Счёт в Kaspi, Halyk и наличные – всё в одном месте.  
 AI‑анализ расходов: вы увидите, где можно сократить 5–10 % от общей суммы.  
 Налоговый калькулятор с обратным отсчётом – никаких штрафов.  
 Кэшбек‑подсказки: выбираете карту для закупок и сразу видите, сколько можете вернуть.  

В течение 7 дней вы сможете проверить, как быстро наш инструмент выявит скрытую прибыль, и если захотите продолжить – отмена в один клик.  

Как вам звучит идея подключить Finvy за 3 минуты и увидеть, где можно сэкономить час работы на бухгалтерию и найти дополнительные 5 % дохода?",,"Тема: Развитие Ультрамарин через финтех-инструменты

Здравствуйте!

Мы проанализировали работу Ультрамарин и видим большой потенциал для оптимизации через Finvy. Наше решение позволяет эффективно управлять финансовыми потоками и привлекать новую аудиторию через систему кешбэка.

Готовы обсудить подробности?

С уважением, команда Finvy.",Партнёрская сеть — кешбэк и акции,,Здравствуйте! Предлагаем Ультрамарин корпоративный доступ к Finvy для сотрудников. Это снижает их финансовый стресс и повышает лояльность к компании. Хотите короткое демо? 🚀,,,"Привет, команда Ультрамарин! 🚀  
Finvy – приложение с кешбэком 15 % на всё. Мы поможем вам привлечь новых клиентов, которые ценят выгоду и хотят выглядеть стильно. Добавляем ваш салон на ул. Крылова 66 в раздел «Рекомендации» и «Кешбэк», а вы получаете трафик и аналитику.  

Готовы увеличить поток клиентов?"
Азамат зорланған жер,"XF9R+RW2, Мұстафа Шоқай көшесі, Усть-Каменогорск 070000, Казахстан",0,0,"establishment, hair_care, health, point_of_interest",,,,,,,,,,Основной оффер Finvy,Звонок,"Скрипт для Азамат зорланған жер:
1. Зацепка: 'Видел ваш высокий рейтинг 0, отличная работа!'
2. Боль: 'Многие владельцы тратят часы на учет личных и бизнес-денег.'
3. Решение: 'Finvy делает это за 5 минут в день.'
4. Закрытие: 'Давайте встретимся на 10 минут во вторник?'",,,,,"Здравствуйте, меня зовут [Ваше имя], я представляю Finvy – сервис, который помогает салонам красоты, как ваш «Азамат зорланған жер», быстро и точно управлять финансами.  

Я видел, что у вашего салона в Усть‑Каменогорске пока нет отзывов, но это не мешает вам зарабатывать. Как вы сейчас контролируете доходы и расходы? В большинстве салонов всё ведётся в Excel или в бумажных записях, а значит часто теряются реальные цифры: сколько действительно осталось после зарплат, аренды, закупки средств, и какие кэшбэки можно получить, просто меняя карту.

Finvy позволяет:
мгновенно увидеть чистую прибыль за каждый месяц – 6.4 млн тенге дохода, 4.1 млн трат – 2.3 млн чистого, без ручного подсчёта;
получать напоминания о налогах до штрафа – “через 18 дней дедлайн, отложи 192 000 ₸”;
подсчитывать реальную стоимость сотрудников, учитывая все отчисления;
анализировать траты и рекомендовать карту с максимальным кэшбэком.

Вы получите эту информацию в одном приложении, которое работает за вас, а не за бухгалтера. Первые семь дней – бесплатно, отмена в один клик.

Могу ли я показать вам, как Finvy может сэкономить вам часы работы и раскрыть скрытую прибыль?",,"Тема: Развитие Азамат зорланған жер через финтех-инструменты

Здравствуйте!

Мы проанализировали работу Азамат зорланған жер и видим большой потенциал для оптимизации через Finvy. Наше решение позволяет эффективно управлять финансовыми потоками и привлекать новую аудиторию через систему кешбэка.

Готовы обсудить подробности?

С уважением, команда Finvy.",Партнёрская сеть — кешбэк и акции,,Здравствуйте! Предлагаем Азамат зорланған жер корпоративный доступ к Finvy для сотрудников. Это снижает их финансовый стресс и повышает лояльность к компании. Хотите короткое демо? 🚀,,,"Привет, команда Азамат зорланған жер!  
У нас в Finvy – супер‑офер 15 % кешбэка на всё, и клиенты уже привыкли искать выгоду.  
Разместив ваш салон в разделе «Рекомендации» и «Кешбэк», вы сразу получите поток платежеспособных посетителей из Усть‑Каменогорска.  
Готовы сделать первый шаг и привлечь новых клиентов? 🚀"
