name,address,rating,reviews_count,types,phone,website,reviews_sample,search_query,owner_name,emails,instagram,whatsapp,telegram,last_scenario,last_channel,pitch_cold_call,pitch_corporate_benefit_email,pitch_corporate_benefit_cold_call,pitch_partner_network_email,pitch_microbusiness_whatsapp,pitch_finvy_main_cold_call,pitch_microbusiness_cold_call,pitch_email,scenario,pitch_partner_network_cold_call,pitch_whatsapp,pitch_corporate_benefit_whatsapp,pitch_microbusiness_email,pitch_partner_network_whatsapp
FOR MEN Barbershop,"пр-т. Нурсултана Назарбаева 2, Усть-Каменогорск 070000, Казахстан",3.7,3,"establishment, hair_care, point_of_interest",,,"Обычная парикмахерская, только цены выше.... | Отличное место для стрижки и обновления!",,,,,,,Основной оффер Finvy,Звонок,"Скрипт для FOR MEN Barbershop:
1. Зацепка: 'Видел ваш высокий рейтинг 3.7, отличная работа!'
2. Боль: 'Многие владельцы тратят часы на учет личных и бизнес-денег.'
3. Решение: 'Finvy делает это за 5 минут в день.'
4. Закрытие: 'Давайте встретимся на 10 минут во вторник?'",,,,,"Здравствуйте, меня зовут [Ваше имя], я представляю Finvy – сервис, который помогает бизнесу как вашому, управлять финансами быстрее и точнее, чем Excel или «счёт в телефоне».

Я заметил, что ваш барбершоп «FOR MEN Barbershop» в Усть‑Каменогорске имеет 3,7‑звёздочный рейтинг и только три отзыва – один о высокой цене, другой о хорошем сервисе. Это типичная ситуация: клиенты довольны, но вы, вероятно, теряете деньги, не видя их полностью. В среднем барбершопы в регионе маржируют около 30 % от выручки, но многие владельцы не знают, какие расходы можно сократить и где скрывается реальная прибыль.

С Finvy вы сможете:

1. За минуты увидеть точный баланс – сколько реально вы заработали, сколько ушло на аренду, зарплаты, налоги, закупки.
2. Получить напоминания о налоговых сроках, чтобы не платить штрафы.
3. Вычислить реальную стоимость каждого сотрудника и оптимизировать расходы.
4. Анализировать карты, чтобы получать кэшбек от каждой покупки – каждый месяц можно вернуть до 10 % от расходов.

Это как если бы вы получили отчёт за 3 минуты вместо того, чтобы тратить часы на бухгалтерию. А первый месяц – бесплатно, а отмена – в один клик.

Могу показать вам, как это работает, если вы захотите. Что скажете – выделим 5 минут в понедельник?",,"Тема: Развитие FOR MEN Barbershop через финтех-инструменты

Здравствуйте!

Мы проанализировали работу FOR MEN Barbershop и видим большой потенциал для оптимизации через Finvy. Наше решение позволяет эффективно управлять финансовыми потоками и привлекать новую аудиторию через систему кешбэка.

Готовы обсудить подробности?

С уважением, команда Finvy.",Партнёрская сеть — кешбэк и акции,,Здравствуйте! Предлагаем FOR MEN Barbershop корпоративный доступ к Finvy для сотрудников. Это снижает их финансовый стресс и повышает лояльность к компании. Хотите короткое демо? 🚀,,,"Привет! Я из Finvy – приложения, где 15 % кешбэк на всё уже привлекает миллионы пользователей. Ваш барберсалон FOR MEN в Усть‑Каменогорске выглядит отличным местом для стрижки, но отзывы упоминают «высокие цены». С нами вы получите поток клиентов, которые ценят выгоду – и всё через наш раздел «Кешбэк». Хотите, чтобы ваш бизнес появился в Finvy и привлек новых клиентов? Да/Нет."
PROBOR,"Антон Чехов 56, Усть-Каменогорск 070000, Казахстан",5,1,"establishment, hair_care, health, point_of_interest",,,"прекрасное заведение , хорошие мастера",,,,,,,Основной оффер Finvy,Звонок,"Скрипт для PROBOR:
1. Зацепка: 'Видел ваш высокий рейтинг 5, отличная работа!'
2. Боль: 'Многие владельцы тратят часы на учет личных и бизнес-денег.'
3. Решение: 'Finvy делает это за 5 минут в день.'
4. Закрытие: 'Давайте встретимся на 10 минут во вторник?'",,,,,"Здравствуйте, меня зовут Алексей, я представляю Finvy – сервис, который помогает салонам красоты, таким как ваш, управлять финансами без лишних хлопот.  

Я увидел, что PROBOR в Усть-Каменогорске получает 5‑звездочный рейтинг и отзывы «прекрасное заведение» и «хорошие мастера». Это значит, что вы уже привлекаете клиентов, но как вы сейчас контролируете свои доходы и расходы?  

Многие владельцы салонов тратят часы на Excel‑таблицы, записки в телефоне и расчёты налогов вручную. Finvy позволяет:

 Сразу увидеть реальную прибыль за месяц – не догадки, а конкретные цифры.
 Напоминать о налоговых сроках, чтобы не получить штраф.
 Показывать точную стоимость каждого сотрудника с учётом всех отчислений.
 Подсказывать карту, которая принесёт максимальный кэшбек от закупок.

Представьте, что вы за месяц заработали 5 млн тенге, но не видите, куда ушли 2 млн тенге. С Finvy вы сразу увидите, что 41 % от расходов – это закупки, а правильный выбор карты может вернуть вам несколько тысяч тенге в месяц в виде кэшбека.  

Мы предлагаем первый семидневный период бесплатно, а подключить Finvy можно за 3 минуты – без бухгалтеров и сложных программ.  

Можно ли договориться о коротком звонке, чтобы показать вам, как именно ваш бизнес может сэкономить часы работы и открыть скрытую прибыль?",,"Тема: Развитие PROBOR через финтех-инструменты

Здравствуйте!

Мы проанализировали работу PROBOR и видим большой потенциал для оптимизации через Finvy. Наше решение позволяет эффективно управлять финансовыми потоками и привлекать новую аудиторию через систему кешбэка.

Готовы обсудить подробности?

С уважением, команда Finvy.",Партнёрская сеть — кешбэк и акции,,"Привет! Я заметил, что PROBOR в Усть‑Каменогорске – отличный салон с 5‑звёздным рейтингом и отзывами «прекрасное заведение», «хорошие мастера». 💇‍♂️

Мы в Finvy хотим предложить вам бесплатный маркетинговый канал: разместить ваш сервис в разделе «Рекомендации» и «Кешбэк» для нашей платежеспособной аудитории. 📈

Это даст вам поток новых клиентов без затрат. Заинтересованы?",,,"Привет, команда PROBOR! 💇‍♂️  
Ваш салон на Антон Чехов 56 уже получил 5‑звёздочный рейтинг и восторженные отзывы: «прекрасное заведение, хорошие мастера». Finvy может разместить ваш профиль в разделе «Рекомендации» и предложить клиентам 15 % кешбэк, чтобы привлечь тех, кто ценит выгоду.  
Готовы обсудить детали?"
Барбершоп BORODACH,"пр-т. Нурсултана Назарбаева 35, Усть-Каменогорск 070000, Казахстан",5,1,"establishment, hair_care, health, point_of_interest",8 (705) 419 5551,https://www.instagram.com/borodach_ukg?igsh=bWMzdmV0Y2Q4YjZw,,,,,rsrc.php,,,Основной оффер Finvy,Звонок,"Скрипт для Барбершоп BORODACH:
1. Зацепка: 'Видел ваш высокий рейтинг 5, отличная работа!'
2. Боль: 'Многие владельцы тратят часы на учет личных и бизнес-денег.'
3. Решение: 'Finvy делает это за 5 минут в день.'
4. Закрытие: 'Давайте встретимся на 10 минут во вторник?'",,,,,"Здравствуйте, меня зовут [Ваше имя], я представляю Finvy – сервис, который помогает барбершопам, как ваш, управлять финансами без бумажной волокиты. Я увидел ваш профиль в Instagram «BorodachUKG» – 5‑звездный рейтинг, даже с одним отзывом уже видно, что клиенты довольны.  

Я знаю, как важно, чтобы в барбершопе не только стрижки шли как по маслу, но и чтобы прибыль оставалась прозрачной. Представьте, что вы сможете мгновенно видеть, сколько действительно заработали, сколько ушло на закуп материалов, аренду, зарплату и даже кэшбэк. С Finvy вы получите:  

• Автоматический подсчёт чистой прибыли – не «приблизительно», а точные цифры, как в примере 6,4 млн доходов, 4,1 млн расходов и чистый доход 2,3 млн;  

• Напоминания о налогах до того, как придёт штраф – «через 18 дней дедлайн, отложи 192 000 ₸»;  

• Расчёт реальной стоимости каждого сотрудника, включая все отчисления;  

• Персональный кэшбэк‑отчёт, который покажет, какая карта даст максимум возврата за покупки в барбершопе;  

• И всё это в одном приложении, а не в Excel, который вы бросаете в конце месяца.  

Мы уже помогли десяткам барбершопов в Казахстане сократить часы работы бухгалтерии и найти скрытые доходы до 15 %. Установить Finvy занимает всего три минуты, а первые семь дней – бесплатно.  

Не хотите ли вы увидеть, как это работает на примере вашего бизнеса? Я могу быстро показать, сколько можно сэкономить и как увеличить чистую прибыль.",,"Тема: Развитие Барбершоп BORODACH через финтех-инструменты

Здравствуйте!

Мы проанализировали работу Барбершоп BORODACH и видим большой потенциал для оптимизации через Finvy. Наше решение позволяет эффективно управлять финансовыми потоками и привлекать новую аудиторию через систему кешбэка.

Готовы обсудить подробности?

С уважением, команда Finvy.",Партнёрская сеть — кешбэк и акции,,Здравствуйте! Предлагаем Барбершоп BORODACH корпоративный доступ к Finvy для сотрудников. Это снижает их финансовый стресс и повышает лояльность к компании. Хотите короткое демо? 🚀,,,"Привет! 👋 Я из Finvy – у нас 15 % кешбэк на всё, и мы можем разместить ваш барбершоп BORODACH в разделе «Кешбэк» и «Рекомендации». Это прямой поток клиентов, которые уже привыкли экономить и ценят качественный уход, а ваша 5‑звёздная репутация только усилит их доверие. 🌟 Хотите быстро увеличить трафик через наше приложение?"
Barbershop Mr.Grey,"XHCV+735, Усть-Каменогорск 070000, Казахстан",4.2,26,"establishment, hair_care, health, point_of_interest",8 (747) 138 1998,http://www.instagram.com/barbershop_ukg,"Работают не опытные парни. Не умеющие как правильно стричь, по 10 раз меняют насадки чтобы ровно подстричь бока. Очень плохой сервис, меня стриг парень с ну очень злобным лицом как будто я стригусь бесплатно или в долг.  Ещё и дорого. Заплатил 4000 тенге. Не советую идти в эту парикмахерскую. Не соответствует соотношение оказания услуги и цены. Очень, очень плохо. | Не рекомендую не стоит своих денег та же обычная парикмахерская",,,,rsrc.php,,,Основной оффер Finvy,Звонок,"Скрипт для Barbershop Mr.Grey:
1. Зацепка: 'Видел ваш высокий рейтинг 4.2, отличная работа!'
2. Боль: 'Многие владельцы тратят часы на учет личных и бизнес-денег.'
3. Решение: 'Finvy делает это за 5 минут в день.'
4. Закрытие: 'Давайте встретимся на 10 минут во вторник?'",,,,,"Здравствуйте, меня зовут [Ваше имя], я представляю Finvy – сервис, который помогает малому бизнесу, как ваш барбершоп, управлять финансами быстро и без ошибок.  

Я видел, что у Barbershop Mr.Grey в Усть‑Каменогорске 26 отзывов, средний рейтинг 4,2, но многие клиенты жалуются на качество стрижки и высокую цену. Это типичная ситуация: когда клиент не доволен, он возвращает деньги, а вам остаётся только покрыть аренду, зарплату и налоги.  

Представьте, что вы можете за пару минут увидеть, сколько действительно приносит ваш бизнес, а не только как выглядит баланс в Kaspi. Finvy автоматически подключается к вашим счетам (Kaspi, Halyk, наличные) и показывает реальный доход, расходы и чистую прибыль.  

Мы поможем вам:  

1. Увидеть, сколько вы зарабатываете каждый месяц – если ваш оборот 5 млн тенге, вы можете увидеть точный чистый результат без «приближённых» оценок.  
2. Уведомлять о налоговых дедлайнах до того, как придёт штраф.  
3. Подсчитать реальную стоимость каждого сотрудника – включая все отчисления.  
4. Предложить карту, которая даст максимальный кэшбек за закупки товаров для стрижек.  

Всё это – за подписку, которая стоит меньше, чем ежемесячная плата за обычного бухгалтера, и вы получите доступ к AI‑ассистенту, который в один вопрос выдаст вам риски и рекомендации.  

Я предлагаю вам бесплатную пробную версию на 7 дней. За три минуты можно подключить Finvy, и вы сразу увидите, где можно сэкономить, например, сменой карты с Halyk на Kaspi Gold и получить кэшбек, который в год превысит 150 000 тенге.  

Есть ли у вас минутка, чтобы обсудить, как Finvy может помочь вашему барбершопу зарабатывать больше и избавить вас от лишних затрат?",,"Тема: Развитие Barbershop Mr.Grey через финтех-инструменты

Здравствуйте!

Мы проанализировали работу Barbershop Mr.Grey и видим большой потенциал для оптимизации через Finvy. Наше решение позволяет эффективно управлять финансовыми потоками и привлекать новую аудиторию через систему кешбэка.

Готовы обсудить подробности?

С уважением, команда Finvy.",Партнёрская сеть — кешбэк и акции,,Здравствуйте! Предлагаем Barbershop Mr.Grey корпоративный доступ к Finvy для сотрудников. Это снижает их финансовый стресс и повышает лояльность к компании. Хотите короткое демо? 🚀,,,"Привет!  
Мы заметили, что у Barbershop Mr.Grey уже есть аудитория, но отзывы о качестве оставляют желать лучшего. С Finvy вы получите 15 % кешбэк – магнит, который привлечёт платежеспособных клиентов, ищущих выгоду и сервис. Мы разместим ваш бизнес в «Рекомендации» и дадим аналитику новых посетителей. Готовы открыть для себя поток новых клиентов? 🚀💈"
BARON,"пр-т. Нурсултана Назарбаева 5, Усть-Каменогорск 070000, Казахстан",3.7,3,"establishment, hair_care, health, point_of_interest",8 (777) 307 0022,http://taplink.cc/baron_barbershop_uka,"Низкий уровень обслуживания, некомпетентные сотрудники! | Хороший барбершоп с приятной атмосферой и персоналом. Интерьер сделан со вкусом, а цена не выше, чем у конкурентов",,,,baron_barbershop_uka,,,Основной оффер Finvy,Звонок,"Скрипт для BARON:
1. Зацепка: 'Видел ваш высокий рейтинг 3.7, отличная работа!'
2. Боль: 'Многие владельцы тратят часы на учет личных и бизнес-денег.'
3. Решение: 'Finvy делает это за 5 минут в день.'
4. Закрытие: 'Давайте встретимся на 10 минут во вторник?'",,,,,"Здравствуйте, меня зовут [Имя] из Finvy. Я заметил ваш барбершоп BARON, расположенный на проспекте Нурсултана Назарбаева 5 в Усть‑Каменогорске. На сайте у вас три отзыва: один отмечает низкий уровень обслуживания, другой – приятную атмосферу и конкурентные цены. Это значит, что ваш бизнес уже привлекает клиентов, но, возможно, вы теряете деньги из‑за неэффективного учёта расходов и неиспользованных возможностей по кэшбэку.

В Finvy мы помогаем салонам, как ваш, управлять финансами за несколько минут в день, а не часами в Excel. Мы автоматически собираем данные из всех банковских карт и наличных, рассчитываем точную прибыль, напоминаем о налогах до того, как придёт штраф, показываем, какая карта даст максимальный кэшбэк, а также анализируем расходы на персонал.

Представьте, если бы вы могли в любой момент видеть, сколько вы реально заработали за месяц, какие статьи расходов самые крупные и где можно сэкономить. Это поможет вам не только удержать клиентов, но и увеличить чистую прибыль на 10–15 %.

У нас есть бесплатный пробный период 7 дней, а подписка стоит как плата за Яндекс Музыку. Хотели бы вы обсудить, как Finvy может помочь вашему барбершопу за ближайшие недели?",,"Тема: Развитие BARON через финтех-инструменты

Здравствуйте!

Мы проанализировали работу BARON и видим большой потенциал для оптимизации через Finvy. Наше решение позволяет эффективно управлять финансовыми потоками и привлекать новую аудиторию через систему кешбэка.

Готовы обсудить подробности?

С уважением, команда Finvy.",Партнёрская сеть — кешбэк и акции,,Здравствуйте! Предлагаем BARON корпоративный доступ к Finvy для сотрудников. Это снижает их финансовый стресс и повышает лояльность к компании. Хотите короткое демо? 🚀,,,"Привет! Я видел, что BARON – крутой барбершоп на пр‑т. Нурсултана, но отзывы разняться. Finvy даёт 15 % кешбэк, что привлекает клиентов, ценящих выгоду. Мы разместим ваш бизнес в разделе «Кешбэк» и дадим аналитику по трафику. Готов обсудить детали? 💈"
