name,address,rating,reviews_count,types,phone,website,reviews_sample,search_query,owner_name,emails,instagram,whatsapp,telegram,last_scenario,last_channel,pitch_cold_call,pitch_corporate_benefit_email,pitch_corporate_benefit_cold_call,pitch_partner_network_email,pitch_microbusiness_whatsapp,pitch_finvy_main_cold_call,pitch_microbusiness_cold_call,pitch_email,scenario,pitch_partner_network_cold_call,pitch_whatsapp,pitch_corporate_benefit_whatsapp,pitch_microbusiness_email,pitch_partner_network_whatsapp
Selfie Coffee,"ул. Тохтарова 51, Усть-Каменогорск 070000, Казахстан",4.6,99,"cafe, establishment, food, point_of_interest, store",8 (705) 528 1303,https://www.facebook.com/selfiecoffeeuka/,"Уютное, атмосферное место, вкусный кофе, НО! Какая-то ерунда с кухней. 3 раза заказывала одни и те же блинчики и порция каждый раз была 1. Разного размера (когда на 1/3 меньше, это заметно) и 2. Разного состава. И только один из этих 3х раз они были вкусными.  Так что, есть там не советую. Посидеть, поболтать, выпить по чашке кофе - да, не больше | Очень вкусно. Немного медлительно для завтрака, но еда отменная. Заказывали блины с красной рыбой и яйцом пашот. Рекомендую",,,,,,,Основной оффер Finvy,Звонок,"**Приветствие и представление**  
«Добрый день, меня зовут [Ваше имя], я менеджер по партнёрствам в Finvy – платформе, которая соединяет качественные сервисы с целевой, платежеспособной аудиторией. Мы заметили ваш уютный кофе‑бар Selfie Coffee на ул. Тохтарова 51 и очень впечатлены 4.6‑й оценкой и 99 отзывами.  

**Крючок / боль**  
Ваша кофейня уже привлекает любителей хорошего вкуса, но иногда клиенты жалуются на несогласованность порций и сервис, что может оттолкнуть новых посетителей. Увеличить поток постоянных клиентов и получить отзывчивую аудиторию – задача, которую можно решить, не тратя на рекламу.  

**Предложение**  
Finvy размещает ваш бизнес в разделе «Кешбэк» и «Рекомендации», где пользователи активно ищут качественные места, чтобы сэкономить и получить бонусы. Это бесплатный маркетинговый канал, где каждый пользователь уже готов тратить деньги, а ваша точка получает целевых клиентов.  

**Закрытие**  
Давайте устроим короткое демо, чтобы показать, как можно быстро запустить акцию. Когда вам удобно в ближайшие дни?  

**Типичные возражения**  
1️⃣ *«У нас уже есть маркетинг»* – Finvy не заменяет, а дополняет. Вы получаете дополнительный поток, который не требует ваших ресурсов, а просто открывает доступ к аудитории, которая ищет именно такие предложения.  

2️⃣ *«Нам не хватает времени на управление акцией»* – мы полностью берём на себя настройку и отчётность. Вы видите результаты в реальном времени, а нам не нужны ваши часы.  

С нетерпением жду возможности обсудить детали!»",,,,,"Здравствуйте, меня зовут [Имя], я менеджер по продажам в Finvy. Позвольте сразу перейти к делу – я заметил, что Selfie Coffee имеет рейтинг 4,6 из 99 отзывов в Facebook, а также замечательные комментарии о вкусном кофе и уютной атмосфере. Но в одном из отзывов упоминается проблема с консистентностью блюд и небольшая задержка при завтраках. Это типичная «скрытая» потеря времени и денег, которую многие кафе не видят без детального анализа.

Мы предлагаем AI‑помощник, который за 3 минуты подключается к вашим кассовым системам, автоматически собирает данные из Kaspi, Halyk и наличных, и сразу показывает:  
– реальный доход и чистую прибыль за каждый месяц,  
– где именно вы теряете деньги (например, в закупах или излишних расходах),  
– когда и сколько нужно платить налогами, чтобы избежать штрафов,  
– какой банковский чек‑карта даст максимальный кэшбэк, и  
– какова фактическая стоимость каждого сотрудника.

Если вы потратите несколько минут, чтобы посмотреть, сколько вы можете сэкономить на кэшбэке от карт и избежать лишних налоговых платежей, то уже через неделю вы увидите, как растёт ваша чистая прибыль.  

Ваша аудитория оценит, что вы работаете с точной информацией, а не с догадками. И всё это за цену, сопоставимую с подпиской на Яндекс Музыку.  

Я предлагаю вам бесплатно протестировать Finvy в течение первых 7 дней. Если не будете довольны, отмена в один клик. Как вам идея попробовать и посмотреть, сколько денег можно вернуть в ваш кассовый ящик за первый месяц?",,"**Тема:** Увеличьте поток клиентов в Selfie Coffee через Finvy  

Здравствуйте!  

Мы заметили, как Selfie Coffee привлекает ценителей хорошего кофе в Усть‑Каменогорске: 4,6 из 5, множество положительных отзывов и уютная атмосфера. В Finvy у нас есть аудитория, которая активно планирует и контролирует расходы, и именно такие люди ищут качественные места для отдыха.  

Предлагаем разместить ваш кофе‑шоп в разделе «Рекомендации» и «Кешбэк» Finvy. Это бесплатный маркетинговый канал, который принесёт целевых клиентов, готовых платить за вкусный кофе и приятную обстановку. Вы получите повышенную видимость, а наши пользователи — выгодные предложения.  

Готовы обсудить детали? Свяжитесь с нами по email или телефону, чтобы включить Selfie Coffee в список партнёров Finvy.  

С уважением,  
[Ваше имя]  
Менеджер по партнёрствам, Finvy",Партнёрская сеть — кешбэк и акции,,"Привет, команда Selfie Coffee ☕️! Я увидел ваш уютный кафе и отличные отзывы, особенно про блины с красной рыбой. В Finvy хотим добавить вас в раздел «Рекомендации», чтобы привлечь целевых клиентов, уже следящих за своими финансами. Это полностью бесплатно, без затрат – только выгода. Заинтересованы в сотрудничестве?",,,"Привет, команда Selfie Coffee! 🎉 У нас 15 % кешбэк на всё, и пользователи Finvy уже ищут уютные места с вкусным кофе – как ваш на Тохтарова 51. Они ценят качество и атмосферу, а отзывы подтверждают это. Добавьте ваш профиль в раздел «Рекомендации» и сразу увидите поток новых клиентов. Готовы попробовать? Да"
Папа Джованни,"Сагадат Нурмагамбетова 34, Усть-Каменогорск 070000, Казахстан",4.8,57,"cafe, establishment, food, point_of_interest, store",8 (776) 551 1010,,"Был днём. Интересное оформление. Чистый туалет. Приятный персонал.
Заказывал чай черный с курагой и изюмом, в порции 600 мл. Чай вовремя заварен, но в чайник добавлена мята, вкус которой явно превалирует, поэтому получается вовремя заваренный мятный чай. За чайник чая изначально адекватная цена - 1100 тенге с учётом обслуживания, но на выходе совсем другой продукт получается, поэтому такая оценка. | Уютное, не большое комфортное место, где можно вкусно перекусить или посидеть и поболтать с друзьями, кафе не большое, но в этом есть своя изюминка, обязательно зайдите, хотя бы попить вкусный чай!",,,,,,,Основной оффер Finvy,Звонок,"**Приветствие**  
""Здравствуйте! Я [Имя] — менеджер по партнёрствам в Finvy.  

**Крючок / боль**  
Я заметил, что «Папа Джованни» в Усть‑Каменогорске с рейтингом 4,8 и отличными отзывами – это отличный сервис, но в городе много кафе, и потенциальные гости часто остаются в поиске.  

**Предложение**  
Finvy добавит ваше заведение в разделы «Рекомендации» и «Кешбэк» — бесплатный маркетинговый канал, который привлекает платежеспособных пользователей, уже готовых заехать на чашку чая и перекусить.  

**Закрытие**  
Готов показать, как это работает в 15‑минутном демо. Какой день и время в следующую среду вам удобно?  

**Ответы на возражения**  

1️⃣ *«Мы уже пользуемся соцсетями»* – соцсети – это лишь часть аудитории. Finvy напрямую соединяет вас с пользователями, которые ищут кафе, и предоставляет данные о их поведении, чтобы вы могли быстро реагировать.  

2️⃣ *«Нам не нужны новые каналы»* – наш сервис не требует инвестиций, а только расширяет охват среди тех, кто уже ищет качественные места, как ваше, и готов платить за удобство.  

Спасибо за внимание, жду вашего ответа!",,,,,"Здравствуйте, меня зовут [Ваше имя] из команды Finvy. Я не просто звоню в случайное кафе – я посмотрел, что в Усть‑Каменогорске есть «Папа Джованни» с 4,8‑звёздочным рейтингом и более 50 отзывами. Это значит, что у вас уже есть стабильный поток клиентов, и вы умеете делать вкусный чай, как в одном из комментариев, но, как большинство заведений, вы, возможно, не видите полностью, куда уходят деньги.

Представьте, что за каждый 100 000₸, которые приходят в кассу, вы можете сразу увидеть, сколько из них реально остаётся как прибыль, а сколько идёт на закуп, аренду, налоги и так далее. Finvy умеет автоматически собирать данные со всех ваших банковских карт – Kaspi, Halyk, Freedom – и в течение минуту выводить точную картину: прибыль за месяц, самые дорогие статьи расходов, напоминания о налогах до того, как они станут штрафом, и даже подсказку, какую карту использовать для закупок, чтобы получить максимум кэшбека.

Ниже пример: если ваш месяц выручки составляет 5 млн ₸, а расходы – 4,1 млн ₸, Finvy покажет, что чистая прибыль – 900 тыс. ₸ и предложит, например, изменить карту для закупок, чтобы вернуть 15 тыс. ₸ кэшбека в месяц. Это сразу добавит 150 тыс. ₸ к вашему доходу в год.

Всё, что вам нужно – это подключиться за 3 минуты, и в течение первых 7 дней вы можете протестировать сервис бесплатно. Вы можете отменить подписку в любой момент, но я уверен, что вы захотите продолжить, когда увидите, сколько времени и денег вы экономите.

Как вы сейчас контролируете финансы? Давайте обсудим, как Finvy может помочь вашему кафе работать более прибыльно, не тратя часы на Excel и отчёты бухгалтера. Когда удобно поговорить подробнее?",,"Тема: Развитие Папа Джованни через финтех-инструменты

Здравствуйте!

Мы проанализировали работу Папа Джованни и видим большой потенциал для оптимизации через Finvy. Наше решение позволяет эффективно управлять финансовыми потоками и привлекать новую аудиторию через систему кешбэка.

Готовы обсудить подробности?

С уважением, команда Finvy.",Партнёрская сеть — кешбэк и акции,,"Привет, команда Папа Джованни! 👋  
Мы в Finvy помогаем уютным кафе, как ваше, привлекать целевых клиентов через разделы «Рекомендации» и «Кешбэк».  
У вас уже 4.8 звезды и отличные отзывы о чаях и атмосфере, а наш бесплатный маркетинговый канал может вывести их на новый уровень.  
Готовы обсудить, как совместно увеличить поток посетителей? Да?",,,"Привет! Я из Finvy – приложения с кешбэком 15% на всё. Мы хотели бы разместить «Папа Джованни» в разделе «Рекомендации» и «Кешбэк», чтобы привлечь в ваш уютный кафе новых клиентов, которые ценят выгоду. Ваш рейтинг 4.8 и отзывы о чате и атмосфере делают это идеальным! Готовы обсудить детали? ☕"
